{
  "record_id": "rtl-understanding-dual-clock-event-bridge-interface-extraction-v1",
  "schema_version": "1.0.0",
  "task": "interface_extraction",
  "input": {
    "language": "systemverilog",
    "top_module": "dual_clock_event_bridge",
    "rtl_text": "module dual_clock_event_bridge (\n    input  logic src_clk_i,\n    input  logic src_rst_n,\n    input  logic src_event_i,\n    input  logic dst_clk_i,\n    input  logic dst_rst_n,\n    output logic dst_event_o\n);\n  logic src_toggle_q;\n  logic dst_sample_q;\n\n  always_ff @(posedge src_clk_i or negedge src_rst_n) begin\n    if (!src_rst_n) begin\n      src_toggle_q <= 1'b0;\n    end else if (src_event_i) begin\n      src_toggle_q <= ~src_toggle_q;\n    end\n  end\n\n  always_ff @(posedge dst_clk_i or negedge dst_rst_n) begin\n    if (!dst_rst_n) begin\n      dst_sample_q <= 1'b0;\n      dst_event_o  <= 1'b0;\n    end else begin\n      dst_event_o  <= src_toggle_q ^ dst_sample_q;\n      dst_sample_q <= src_toggle_q;\n    end\n  end\nendmodule\n",
    "compile_unit": {
      "files": [
        "datasets/fixtures/rtl-plan/dual_clock_event_bridge.sv"
      ],
      "filelist": null
    }
  },
  "target": {
    "ports": [
      {
        "name": "src_clk_i",
        "direction": "input",
        "data_type": "logic",
        "packed_range": null,
        "evidence": [
          {
            "file": "datasets/fixtures/rtl-plan/dual_clock_event_bridge.sv",
            "line_start": 2,
            "line_end": 2
          }
        ]
      },
      {
        "name": "src_rst_n",
        "direction": "input",
        "data_type": "logic",
        "packed_range": null,
        "evidence": [
          {
            "file": "datasets/fixtures/rtl-plan/dual_clock_event_bridge.sv",
            "line_start": 3,
            "line_end": 3
          }
        ]
      },
      {
        "name": "src_event_i",
        "direction": "input",
        "data_type": "logic",
        "packed_range": null,
        "evidence": [
          {
            "file": "datasets/fixtures/rtl-plan/dual_clock_event_bridge.sv",
            "line_start": 4,
            "line_end": 4
          }
        ]
      },
      {
        "name": "dst_clk_i",
        "direction": "input",
        "data_type": "logic",
        "packed_range": null,
        "evidence": [
          {
            "file": "datasets/fixtures/rtl-plan/dual_clock_event_bridge.sv",
            "line_start": 5,
            "line_end": 5
          }
        ]
      },
      {
        "name": "dst_rst_n",
        "direction": "input",
        "data_type": "logic",
        "packed_range": null,
        "evidence": [
          {
            "file": "datasets/fixtures/rtl-plan/dual_clock_event_bridge.sv",
            "line_start": 6,
            "line_end": 6
          }
        ]
      },
      {
        "name": "dst_event_o",
        "direction": "output",
        "data_type": "logic",
        "packed_range": null,
        "evidence": [
          {
            "file": "datasets/fixtures/rtl-plan/dual_clock_event_bridge.sv",
            "line_start": 7,
            "line_end": 7
          }
        ]
      }
    ],
    "summary": {
      "input_count": 5,
      "output_count": 1,
      "inout_count": 0,
      "total_port_count": 6
    }
  },
  "metadata": {
    "source_type": "repo_fixture",
    "source_group": "dual_clock_event_bridge",
    "difficulty": "easy",
    "domain_tags": [
      "bridge"
    ],
    "lineage_root": "datasets/fixtures/rtl-plan/dual_clock_event_bridge.sv"
  },
  "provenance": {
    "license": "MIT",
    "origin_repo": "local:asic-ai-workflows",
    "origin_commit": null,
    "origin_path": "datasets/fixtures/rtl-plan/dual_clock_event_bridge.sv",
    "generator": "manual_seed_v1",
    "generator_version": "1.0.0",
    "mutation_id": null,
    "human_review_status": "reviewed"
  }
}
