{
  "record_id": "rtl-understanding-warm-reset-status-bridge-interface-extraction-v1",
  "schema_version": "1.0.0",
  "task": "interface_extraction",
  "input": {
    "language": "systemverilog",
    "top_module": "warm_reset_status_bridge",
    "rtl_text": "module warm_reset_status_bridge (\n    input  logic clk_i,\n    input  logic rst_n,\n    input  logic cfg_rst_n,\n    input  logic cfg_done_i,\n    output logic status_ready_o\n);\n  logic cfg_done_q;\n\n  always_ff @(posedge clk_i or negedge cfg_rst_n) begin\n    if (!cfg_rst_n) begin\n      cfg_done_q <= 1'b0;\n    end else begin\n      cfg_done_q <= cfg_done_i;\n    end\n  end\n\n  always_ff @(posedge clk_i or negedge rst_n) begin\n    if (!rst_n) begin\n      status_ready_o <= 1'b0;\n    end else begin\n      status_ready_o <= cfg_done_q;\n    end\n  end\nendmodule\n",
    "compile_unit": {
      "files": [
        "datasets/fixtures/rtl-plan/warm_reset_status_bridge.sv"
      ],
      "filelist": null
    }
  },
  "target": {
    "ports": [
      {
        "name": "clk_i",
        "direction": "input",
        "data_type": "logic",
        "packed_range": null,
        "evidence": [
          {
            "file": "datasets/fixtures/rtl-plan/warm_reset_status_bridge.sv",
            "line_start": 2,
            "line_end": 2
          }
        ]
      },
      {
        "name": "rst_n",
        "direction": "input",
        "data_type": "logic",
        "packed_range": null,
        "evidence": [
          {
            "file": "datasets/fixtures/rtl-plan/warm_reset_status_bridge.sv",
            "line_start": 3,
            "line_end": 3
          }
        ]
      },
      {
        "name": "cfg_rst_n",
        "direction": "input",
        "data_type": "logic",
        "packed_range": null,
        "evidence": [
          {
            "file": "datasets/fixtures/rtl-plan/warm_reset_status_bridge.sv",
            "line_start": 4,
            "line_end": 4
          }
        ]
      },
      {
        "name": "cfg_done_i",
        "direction": "input",
        "data_type": "logic",
        "packed_range": null,
        "evidence": [
          {
            "file": "datasets/fixtures/rtl-plan/warm_reset_status_bridge.sv",
            "line_start": 5,
            "line_end": 5
          }
        ]
      },
      {
        "name": "status_ready_o",
        "direction": "output",
        "data_type": "logic",
        "packed_range": null,
        "evidence": [
          {
            "file": "datasets/fixtures/rtl-plan/warm_reset_status_bridge.sv",
            "line_start": 6,
            "line_end": 6
          }
        ]
      }
    ],
    "summary": {
      "input_count": 4,
      "output_count": 1,
      "inout_count": 0,
      "total_port_count": 5
    }
  },
  "metadata": {
    "source_type": "repo_fixture",
    "source_group": "warm_reset_status_bridge",
    "difficulty": "easy",
    "domain_tags": [
      "bridge"
    ],
    "lineage_root": "datasets/fixtures/rtl-plan/warm_reset_status_bridge.sv"
  },
  "provenance": {
    "license": "MIT",
    "origin_repo": "local:asic-ai-workflows",
    "origin_commit": null,
    "origin_path": "datasets/fixtures/rtl-plan/warm_reset_status_bridge.sv",
    "generator": "manual_seed_v1",
    "generator_version": "1.0.0",
    "mutation_id": null,
    "human_review_status": "reviewed"
  }
}
